A1: Student Number | B1: Exam1 | C1: Exam2 | D1: Final | E1: RankExam1 | F1: RankExam2 | G1: RankFinal | H1: Weighted Avg. | I1: Grade
A2: e129151-7 | B2: 61 | C2: 88 | D2: 118 | E2: 3 | F2: 1 | G2: 1 | H2: =1/100*(B2*30+C2*30+D2*30) -> 80.1 | I2: AA
A3: e1345222 | B3: 64 | C3: 68 | D3: 111 | E3: 1 | F3: 12 | G3: 2 | H3: =1/100*(B3*30+C3*30+D3*30) -> 72.9 | I3: AA
A4: e129153-3 | B4: 62 | C4: 72 | D4: 96 | E4: 2 | F4: 8 | G4: 4 | H4: =1/100*(B4*30+C4*30+D4*30) -> 69 | I4: AA
A5: e129235-8 | B5: 52 | C5: 71 | D5: 101 | E5: 9 | F5: 9 | G5: 3 | H5: =1/100*(B5*30+C5*30+D5*30) -> 67.2 | I5: AA
A6: e135466-1 | B6: 47 | C6: 80 | D6: 96 | E6: 13 | F6: 4 | G6: 6 | H6: =1/100*(B6*30+C6*30+D6*30) -> 66.9 | I6: AA
A7: e134308-6 | B7: 61 | C7: 69 | D7: 83 | E7: 4 | F7: 10 | G7: 8 | H7: =1/100*(B7*30+C7*30+D7*30) -> 63.9 | I7: BA
A8: e134124-7 | B8: 55 | C8: 74 | D8: 80 | E8: 5 | F8: 5 | G8: 10 | H8: =1/100*(B8*30+C8*30+D8*30) -> 62.7 | I8: BA
A9: e129226-7 | B9: 31 | C9: 56 | D9: 94 | E9: 40 | F9: 17 | G9: 7 | H9: =1/100*(B9*30+C9*30+D9*30) -> 54.3 | I9: BB
A10: e129272-1 | B10: 36 | C10: 49 | D10: 96 | E10: 31 | F10: 27 | G10: 5 | H10: =1/100*(B10*30+C10*30+D10*30) -> 54.3 | I10: BB
A11: e129277-0 | B11: 39 | C11: 55 | D11: 80 | E11: 23 | F11: 19 | G11: 9 | H11: =1/100*(B11*30+C11*30+D11*30) -> 52.2 | I11: CB
A12: e129262-2 | B12: 46 | C12: 69 | D12: 56 | E12: 15 | F12: 11 | G12: 26 | H12: =1/100*(B12*30+C12*30+D12*30) -> 51.3 | I12: CB
A13: e134179-1 | B13: 30 | C13: 84 | D13: 55 | E13: 43 | F13: 2 | G13: 29 | H13: =1/100*(B13*30+C13*30+D13*30) -> 50.7 | I13: CB
A14: e129139-2 | B14: 47 | C14: 60 | D14: 60 | E14: 14 | F14: 15 | G14: 20 | H14: =1/100*(B14*30+C14*30+D14*30) -> 50.1 | I14: CB
A15: e129245-7 | B15: 34 | C15: 64 | D15: 69 | E15: 36 | F15: 14 | G15: 15 | H15: =1/100*(B15*30+C15*30+D15*30) -> 50.1 | I15: CB
A16: e129188-9 | B16: 36 | C16: 56 | D16: 70 | E16: 30 | F16: 18 | G16: 14 | H16: =1/100*(B16*30+C16*30+D16*30) -> 48.6 | I16: CC
A17: e129215-0 | B17: 43 | C17: 74 | D17: 39 | E17: 19 | F17: 6 | G17: 51 | H17: =1/100*(B17*30+C17*30+D17*30) -> 46.8 | I17: CC
A18: e129257-2 | B18: 25 | C18: 72 | D18: 58 | E18: 52 | F18: 7 | G18: 23 | H18: =1/100*(B18*30+C18*30+D18*30) -> 46.5 | I18: CC
A19: e134153-6 | B19: 43 | C19: 52 | D19: 59 | E19: 18 | F19: 24 | G19: 21 | H19: =1/100*(B19*30+C19*30+D19*30) -> 46.2 | I19: CC
A20: e129170-7 | B20: 28 | C20: 54 | D20: 71 | E20: 46 | F20: 21 | G20: 13 | H20: =1/100*(B20*30+C20*30+D20*30) -> 45.9 | I20: DC
A21: e119854-8 | B21: 44 | C21: 39 | D21: 69 | E21: 17 | F21: 33 | G21: 16 | H21: =1/100*(B21*30+C21*30+D21*30) -> 45.6 | I21: DC
A22: e129146-7 | B22: 38 | C22: 59 | D22: 50 | E22: 24 | F22: 16 | G22: 36 | H22: =1/100*(B22*30+C22*30+D22*30) -> 44.1 | I22: DC
A23: e129341 | B23: 48 | C23: 48 | D23: 50 | E23: 11 | F23: 28 | G23: 38 | H23: =1/100*(B23*30+C23*30+D23*30) -> 43.8 | I23: DC
A24: e129142-6 | B24: 29 | C24: 42 | D24: 63 | E24: 44 | F24: 30 | G24: 18 | H24: =1/100*(B24*30+C24*30+D24*30) -> 40.2 | I24: DC
A25: e129155-8 | B25: 39 | C25: 49 | D25: 44 | E25: 22 | F25: 26 | G25: 46 | H25: =1/100*(B25*30+C25*30+D25*30) -> 39.6 | I25: DD
A26: e119672-4 | B26: 29 | C26: 51 | D26: 52 | E26: 45 | F26: 25 | G26: 32 | H26: =1/100*(B26*30+C26*30+D26*30) -> 39.6 | I26: DD
A27: e119720-1 | B27: 53 | C27: 29 | D27: 48 | E27: 6 | F27: 47 | G27: 40 | H27: =1/100*(B27*30+C27*30+D27*30) -> 39 | I27: DD
A28: e119798-7 | B28: 41 | C28: 36 | D28: 51 | E28: 21 | F28: 37 | G28: 34 | H28: =1/100*(B28*30+C28*30+D28*30) -> 38.4 | I28: DD
A29: e124393-0 | B29: 51 | C29: 18 | D29: 56 | E29: 10 | F29: 55 | G29: 27 | H29: =1/100*(B29*30+C29*30+D29*30) -> 37.5 | I29: DD
A30: e119762-3 | B30: 37 | C30: 17 | D30: 69 | E30: 29 | F30: 56 | G30: 19 | H30: =1/100*(B30*30+C30*30+D30*30) -> 36.9 | I30: DD
A31: e119796-1 | B31: 37 | C31: 39 | D31: 47 | E31: 27 | F31: 32 | G31: 43 | H31: =1/100*(B31*30+C31*30+D31*30) -> 36.9 | I31: DD
A32: e129223-4 | B32: 21 | C32: 45 | D32: 57 | E32: 56 | F32: 29 | G32: 25 | H32: =1/100*(B32*30+C32*30+D32*30) -> 36.9 | I32: DD
A33: e119679 | B33: 35 | C33: 33 | D33: 52 | E33: 34 | F33: 38 | G33: 31 | H33: =1/100*(B33*30+C33*30+D33*30) -> 36 | I33: DD
A34: e134209-6 | B34: 26 | C34: 27 | D34: 66 | E34: 51 | F34: 51 | G34: 17 | H34: =1/100*(B34*30+C34*30+D34*30) -> 35.7 | I34: DD
A35: e125547-0 | B35: 38 | C35: 32 | D35: 48 | E35: 25 | F35: 39 | G35: 41 | H35: =1/100*(B35*30+C35*30+D35*30) -> 35.4 | I35: DD
A36: 658739 | B36: 45 | C36: 31 | D36: 41 | E36: 16 | F36: 41 | G36: 50 | H36: =1/100*(B36*30+C36*30+D36*30) -> 35.1 | I36: FD
A37: e115984-7 | B37: 30 | C37: 29 | D37: 54 | E37: 41 | F37: 45 | G37: 35 | H37: =1/100*(B37*30+C37*30+D37*30) -> 33.9 | I37: FD
A38: e119849-8 | B38: 32 | C38: 36 | D38: 45 | E38: 38 | F38: 35 | G38: 45 | H38: =1/100*(B38*30+C38*30+D38*30) -> 33.9 | I38: FD
A39: e124366-6 | B39: 28 | C39: 30 | D39: 53 | E39: 48 | F39: 43 | G39: 30 | H39: =1/100*(B39*30+C39*30+D39*30) -> 33.3 | I39: FF
A40: e129265-5 | B40: 15 | C40: 53 | D40: 41 | E40: 59 | F40: 23 | G40: 49 | H40: =1/100*(B40*30+C40*30+D40*30) -> 32.7 | I40: FF
A41: e-124484-7 | B41: 28 | C41: 31 | D41: 48 | E41: 47 | F41: 40 | G41: 42 | H41: =1/100*(B41*30+C41*30+D41*30) -> 32.1 | I41: FF
A42: e129236-6 | B42: 43 | C42: 20 | D42: 41 | E42: 20 | F42: 54 | G42: 48 | H42: =1/100*(B42*30+C42*30+D42*30) -> 31.2 | I42: FF
A43: e124482-1 | B43: 13 | C43: 29 | D43: 59 | E43: 63 | F43: 46 | G43: 22 | H43: =1/100*(B43*30+C43*30+D43*30) -> 30.3 | I43: FF
A44: e129320-8 | B44: 35 | C44: 30 | D44: 32 | E44: 33 | F44: 44 | G44: 57 | H44: =1/100*(B44*30+C44*30+D44*30) -> 29.1 | I44: FF
A45: 1244995 | B45: 20 | C45: 28 | D45: 49 | E45: 57 | F45: 48 | G45: 39 | H45: =1/100*(B45*30+C45*30+D45*30) -> 29.1 | I45: FF
A46: e124501-8 | B46: 24 | C46: 21 | D46: 50 | E46: 53 | F46: 53 | G46: 37 | H46: =1/100*(B46*30+C46*30+D46*30) -> 28.5 | I46: FF
A47: e129156-6 | B47: 33 | C47: 14 | D47: 47 | E47: 37 | F47: 60 | G47: 44 | H47: =1/100*(B47*30+C47*30+D47*30) -> 28.2 | I47: FF
A48: e124488-8 | B48: 30 | C48: 27 | D48: 35 | E48: 42 | F48: 50 | G48: 56 | H48: =1/100*(B48*30+C48*30+D48*30) -> 27.6 | I48: FF
A49: e115930-0 | B49: 32 | C49: 21 | D49: 38 | E49: 39 | F49: 31 | G49: 54 | H49: =1/100*(B49*30+C49*30+D49*30) -> 27.3 | I49: FF
A50: e124551-3 | B50: 53 | C50: 15 | D50: 22 | E50: 8 | F50: 58 | G50: 62 | H50: =1/100*(B50*30+C50*30+D50*30) -> 27 | I50: FF
A51: e124471-4 | B51: 35 | C51: 14 | D51: 39 | E51: 32 | F51: 61 | G51: 52 | H51: =1/100*(B51*30+C51*30+D51*30) -> 26.4 | I51: FF
A52: e124365-8 | B52: 14 | C52: 28 | D52: 42 | E52: 62 | F52: 49 | G52: 47 | H52: =1/100*(B52*30+C52*30+D52*30) -> 25.2 | I52: FF
A53: e124417-7 | B53: 22 | C53: 31 | D53: 30 | E53: 55 | F53: 42 | G53: 58 | H53: =1/100*(B53*30+C53*30+D53*30) -> 24.9 | I53: FF
A54: e127178-2 | B54: 26 | C54: 36 | D54: 16 | E54: 50 | F54: 36 | G54: 63 | H54: =1/100*(B54*30+C54*30+D54*30) -> 23.4 | I54: FF
A55: e129201-0 | B55: 23 | C55: 8 | D55: 39 | E55: 54 | F55: 64 | G55: 53 | H55: =1/100*(B55*30+C55*30+D55*30) -> 21 | I55: FF
A56: e129291-1 | B56: 27 | C56: 15 | D56: 25 | E56: 49 | F56: 57 | G56: 61 | H56: =1/100*(B56*30+C56*30+D56*30) -> 20.1 | I56: FF
A57: e116013-4 | B57: 18 | C57: 11 | D57: 35 | E57: 58 | F57: 62 | G57: 55 | H57: =1/100*(B57*30+C57*30+D57*30) -> 19.2 | I57: FF
A58: e129193-9 | B58: 14 | C58: 23 | D58: 26 | E58: 60 | F58: 52 | G58: 59 | H58: =1/100*(B58*30+C58*30+D58*30) -> 18.9 | I58: FF
A59: e129177-2 | B59: 14 | C59: 7 | D59: 26 | E59: 61 | F59: 65 | G59: 60 | H59: =1/100*(B59*30+C59*30+D59*30) -> 14.1 | I59: FF
A60: e115970-6 | B60: 9 | C60: 15 | D60: 15 | E60: 64 | F60: 59 | G60: 64 | H60: =1/100*(B60*30+C60*30+D60*30) -> 11.7 | I60: FF
A61: 12300 | B61: 7 | C61: 10 | D61: 11 | E61: 65 | F61: 63 | G61: 65 | H61: =1/100*(B61*30+C61*30+D61*30) -> 8.4 | I61: FF